{
  "schema_version": 1,
  "package_id": "cat-sweetness",
  "platform": "youtube",
  "format": "short",
  "title": "Why Cats Can't Taste Sweetness",
  "description": "Domestic cats carry an unexpressed Tas1r2 pseudogene, so the two-part sweet-taste receptor cannot form.\n\nA cat's indifference to sweets is receptor biology, not pickiness or a preference for expensive food.\n\nSources:\n- Li, X. et al. (2005). Pseudogenization of a Sweet-Receptor Gene Accounts for Cats' Indifference toward Sugar. PLoS Genetics 1(1), e3. https://doi.org/10.1371/journal.pgen.0010003\n\nReal-footage montage using third-party clips for illustration; not documentary footage or scientific evidence. Educational content, not veterinary advice. Consult a veterinarian for health concerns.\n\n#Cats #CatScience #AnimalScience #Shorts",
  "hashtags": [
    "#Cats",
    "#CatScience",
    "#AnimalScience",
    "#Shorts"
  ],
  "tags": [
    "cats taste sweetness",
    "cat taste buds",
    "Tas1r2",
    "cat genetics",
    "cat senses",
    "why cats cant taste sugar",
    "feline science",
    "cats",
    "documentary short"
  ],
  "category": "Pets & Animals",
  "category_id": "15",
  "language": "en",
  "visibility": "private",
  "made_for_kids": false,
  "visual_mode": "real_footage_montage",
  "contains_synthetic_media": false,
  "visual_disclosure": "Real-footage montage using third-party clips for illustration; not documentary footage or scientific evidence.",
  "footage_provider": null,
  "footage_attributions": [],
  "educational_disclaimer": "Educational content, not veterinary advice. Consult a veterinarian for health concerns.",
  "manual_upload_required": true,
  "duration_s": 45,
  "aspect_ratio": "9:16",
  "resolution": "1080x1920",
  "sources": [
    {
      "id": "li-2005",
      "citation": "Li, X. et al. (2005). Pseudogenization of a Sweet-Receptor Gene Accounts for Cats' Indifference toward Sugar. PLoS Genetics 1(1), e3. https://doi.org/10.1371/journal.pgen.0010003",
      "url": "https://doi.org/10.1371/journal.pgen.0010003",
      "doi": "10.1371/journal.pgen.0010003",
      "pmid": "16103917"
    }
  ],
  "youtube_video_id": null,
  "youtube_url": null,
  "upload_status": "not_uploaded_manual_only"
}
